{
  "engine": "android-embedded-v8",
  "metadata": {
    "callsite": "unavailable",
    "entryDetail": "unavailable",
    "origin": "unavailable",
    "source": "available"
  },
  "provenance": {
    "generationLevel": "behavioralProbe",
    "metadata": "behavioralProbe",
    "perCompilationCallback": "behavioralProbe"
  },
  "schemaVersion": 1,
  "strings": {
    "generationLevelDeny": true,
    "perCompilationCallback": true
  },
  "wasm": {
    "generationLevelDeny": true,
    "perCompilationCallback": true
  }
}
